[
  {
    "rule_id": "rule_0001",
    "rule_name": "compound_double_progression",
    "rule_category": "double_progression",
    "applicable_exercise_types": "free_weight_compound|machine_compound",
    "applicable_exercise_ids": "",
    "applicable_muscle_groups": "",
    "applicable_training_levels": "novice|intermediate",
    "applicable_nutrition_phases": "maintenance|recomposition|surplus",
    "required_inputs": "set_reps|rep_range_high|average_rir|target_rir_low|technique_pass|rom_pass",
    "condition_logic": "{\"and\":[{\"all_sets_gte\":\"rep_range_high\"},{\"gte\":[\"average_rir\",\"target_rir_low\"]},{\"eq\":[\"technique_pass\",true]},{\"eq\":[\"rom_pass\",true]},{\"confirmed_sessions_gte\":2}]}",
    "threshold_value_1": 2,
    "threshold_unit_1": "confirmation_sessions",
    "threshold_value_2": 5,
    "threshold_unit_2": "maximum_load_increase_percent",
    "minimum_sessions_required": 2,
    "recommended_action": "increase_load_by_smallest_valid_increment",
    "load_adjustment_percent": 2.5,
    "rep_adjustment": 0,
    "set_adjustment": 0,
    "rir_adjustment": 0,
    "rest_adjustment_seconds": 0,
    "exceptions": "Do not apply when technique or ROM is not standardized, pain is present, or required inputs are missing.",
    "supporting_study_ids": "stu_0029|stu_0030|stu_0031",
    "direct_or_inferred_rule": "inferred",
    "evidence_strength": "low",
    "confidence_rating": "moderate",
    "notes": "Deterministic operational rule; thresholds are conservative defaults, not proven biological cut points."
  },
  {
    "rule_id": "rule_0002",
    "rule_name": "isolation_dynamic_double_progression",
    "rule_category": "dynamic_double_progression",
    "applicable_exercise_types": "machine_isolation|cable_isolation|free_weight_isolation",
    "applicable_exercise_ids": "",
    "applicable_muscle_groups": "",
    "applicable_training_levels": "novice|intermediate|advanced",
    "applicable_nutrition_phases": "all",
    "required_inputs": "set_reps|rep_range_high|average_rir|technique_pass|rom_pass",
    "condition_logic": "{\"and\":[{\"set_count_at_top_gte\":\"all_but_one\"},{\"gte\":[\"average_rir\",1]},{\"eq\":[\"technique_pass\",true]},{\"eq\":[\"rom_pass\",true]}]}",
    "threshold_value_1": 5,
    "threshold_unit_1": "maximum_increment_percent",
    "threshold_value_2": null,
    "threshold_unit_2": "",
    "minimum_sessions_required": 1,
    "recommended_action": "increase_load_if_increment_is_5_percent_or_less_else_add_reps",
    "load_adjustment_percent": 2.5,
    "rep_adjustment": 0,
    "set_adjustment": 0,
    "rir_adjustment": 0,
    "rest_adjustment_seconds": 0,
    "exceptions": "Do not apply when technique or ROM is not standardized, pain is present, or required inputs are missing.",
    "supporting_study_ids": "stu_0029|stu_0030|stu_0031",
    "direct_or_inferred_rule": "inferred",
    "evidence_strength": "low",
    "confidence_rating": "low",
    "notes": "Deterministic operational rule; thresholds are conservative defaults, not proven biological cut points."
  },
  {
    "rule_id": "rule_0003",
    "rule_name": "high_skill_compound_load_progression",
    "rule_category": "load_first_progression",
    "applicable_exercise_types": "free_weight_compound",
    "applicable_exercise_ids": "",
    "applicable_muscle_groups": "",
    "applicable_training_levels": "intermediate|advanced",
    "applicable_nutrition_phases": "maintenance|surplus",
    "required_inputs": "e1rm|e1rm_recent_median|average_rir|technique_pass|rom_pass",
    "condition_logic": "{\"and\":[{\"gte\":[\"e1rm_change_percent\",2]},{\"between\":[\"average_rir\",1,4]},{\"eq\":[\"technique_pass\",true]},{\"confirmed_sessions_gte\":2}]}",
    "threshold_value_1": 2,
    "threshold_unit_1": "minimum_e1rm_improvement_percent",
    "threshold_value_2": 3,
    "threshold_unit_2": "maximum_load_increase_percent",
    "minimum_sessions_required": 2,
    "recommended_action": "increase_load_1_to_3_percent_and_reset_reps_within_range",
    "load_adjustment_percent": 2,
    "rep_adjustment": 0,
    "set_adjustment": 0,
    "rir_adjustment": 0,
    "rest_adjustment_seconds": 0,
    "exceptions": "Do not apply when technique or ROM is not standardized, pain is present, or required inputs are missing.",
    "supporting_study_ids": "stu_0029|stu_0030|stu_0031",
    "direct_or_inferred_rule": "inferred",
    "evidence_strength": "low",
    "confidence_rating": "moderate",
    "notes": "Deterministic operational rule; thresholds are conservative defaults, not proven biological cut points."
  },
  {
    "rule_id": "rule_0004",
    "rule_name": "bodyweight_rep_then_load",
    "rule_category": "rep_first_progression",
    "applicable_exercise_types": "bodyweight_compound",
    "applicable_exercise_ids": "",
    "applicable_muscle_groups": "",
    "applicable_training_levels": "novice|intermediate|advanced",
    "applicable_nutrition_phases": "all",
    "required_inputs": "set_reps|rep_range_high|average_rir|added_load|technique_pass",
    "condition_logic": "{\"and\":[{\"all_sets_gte\":\"rep_range_high\"},{\"gte\":[\"average_rir\",1]},{\"eq\":[\"technique_pass\",true]}]}",
    "threshold_value_1": 2,
    "threshold_unit_1": "minimum_confirmation_sessions_for_high_variability",
    "threshold_value_2": null,
    "threshold_unit_2": "",
    "minimum_sessions_required": 2,
    "recommended_action": "add_small_external_load_or_reduce_assistance",
    "load_adjustment_percent": 2.5,
    "rep_adjustment": 0,
    "set_adjustment": 0,
    "rir_adjustment": 0,
    "rest_adjustment_seconds": 0,
    "exceptions": "Do not apply when technique or ROM is not standardized, pain is present, or required inputs are missing.",
    "supporting_study_ids": "stu_0029|stu_0030|stu_0031",
    "direct_or_inferred_rule": "inferred",
    "evidence_strength": "low",
    "confidence_rating": "moderate",
    "notes": "Deterministic operational rule; thresholds are conservative defaults, not proven biological cut points."
  },
  {
    "rule_id": "rule_0005",
    "rule_name": "rep_progression_before_load",
    "rule_category": "rep_first_progression",
    "applicable_exercise_types": "cable_isolation|free_weight_isolation|machine_isolation",
    "applicable_exercise_ids": "",
    "applicable_muscle_groups": "",
    "applicable_training_levels": "all",
    "applicable_nutrition_phases": "all",
    "required_inputs": "set_reps|rep_range_high|rir|technique_pass",
    "condition_logic": "{\"and\":[{\"any_set_lt\":\"rep_range_high\"},{\"gte\":[\"rir\",1]},{\"eq\":[\"technique_pass\",true]}]}",
    "threshold_value_1": null,
    "threshold_unit_1": "",
    "threshold_value_2": null,
    "threshold_unit_2": "",
    "minimum_sessions_required": 1,
    "recommended_action": "add_one_rep_to_lowest_eligible_set",
    "load_adjustment_percent": 0,
    "rep_adjustment": 1,
    "set_adjustment": 0,
    "rir_adjustment": 0,
    "rest_adjustment_seconds": 0,
    "exceptions": "Do not apply when technique or ROM is not standardized, pain is present, or required inputs are missing.",
    "supporting_study_ids": "stu_0029|stu_0030|stu_0031",
    "direct_or_inferred_rule": "inferred",
    "evidence_strength": "low",
    "confidence_rating": "moderate",
    "notes": "Deterministic operational rule; thresholds are conservative defaults, not proven biological cut points."
  },
  {
    "rule_id": "rule_0006",
    "rule_name": "same_performance_lower_effort",
    "rule_category": "rpe_rir_progression",
    "applicable_exercise_types": "free_weight_compound|machine_compound|machine_isolation|cable_isolation",
    "applicable_exercise_ids": "",
    "applicable_muscle_groups": "",
    "applicable_training_levels": "all",
    "applicable_nutrition_phases": "all",
    "required_inputs": "load|reps|rir|prior_rir|technique_pass",
    "condition_logic": "{\"and\":[{\"eq\":[\"load\",\"prior_load\"]},{\"gte\":[\"reps\",\"prior_reps\"]},{\"gte\":[{\"subtract\":[\"rir\",\"prior_rir\"]},1]},{\"eq\":[\"technique_pass\",true]}]}",
    "threshold_value_1": 1,
    "threshold_unit_1": "rir_improvement",
    "threshold_value_2": null,
    "threshold_unit_2": "",
    "minimum_sessions_required": 2,
    "recommended_action": "classify_as_progression_hold_load_until_rep_range_rule_is_met",
    "load_adjustment_percent": 0,
    "rep_adjustment": 0,
    "set_adjustment": 0,
    "rir_adjustment": 0,
    "rest_adjustment_seconds": 0,
    "exceptions": "Do not apply when technique or ROM is not standardized, pain is present, or required inputs are missing.",
    "supporting_study_ids": "stu_0029|stu_0030|stu_0031",
    "direct_or_inferred_rule": "inferred",
    "evidence_strength": "low",
    "confidence_rating": "moderate",
    "notes": "Deterministic operational rule; thresholds are conservative defaults, not proven biological cut points."
  },
  {
    "rule_id": "rule_0007",
    "rule_name": "normal_noise_hold",
    "rule_category": "noise_detection",
    "applicable_exercise_types": "all",
    "applicable_exercise_ids": "",
    "applicable_muscle_groups": "",
    "applicable_training_levels": "all",
    "applicable_nutrition_phases": "all",
    "required_inputs": "performance_change_percent|rep_change|fatigue_flags",
    "condition_logic": "{\"and\":[{\"gte\":[\"performance_change_percent\",-5]},{\"lte\":[\"performance_change_percent\",2]},{\"lte\":[\"consecutive_declines\",1]}]}",
    "threshold_value_1": -5,
    "threshold_unit_1": "lower_e1rm_change_percent",
    "threshold_value_2": 2,
    "threshold_unit_2": "upper_e1rm_change_percent",
    "minimum_sessions_required": 1,
    "recommended_action": "classify_as_noise_or_maintenance_and_repeat_prescription",
    "load_adjustment_percent": 0,
    "rep_adjustment": 0,
    "set_adjustment": 0,
    "rir_adjustment": 0,
    "rest_adjustment_seconds": 0,
    "exceptions": "Do not apply when technique or ROM is not standardized, pain is present, or required inputs are missing.",
    "supporting_study_ids": "stu_0029|stu_0030",
    "direct_or_inferred_rule": "inferred",